{
  "task": "ising28_uncond",
  "hardware": "arm (JAX CPU)",
  "hardware_class": "cpu",
  "method": "thermal-tbro",
  "recipe_name": "tbro-cpu-thermal",
  "commit": "main",
  "contributor": "SoundSafe-Dev",
  "submission_url": "https://github.com/SoundSafe-Dev/thrml",
  "seeds": [
    42,
    123,
    456
  ],
  "config": {
    "H": 28,
    "W": 28,
    "steps_per_sample": 2,
    "warmup": 100,
    "n_samples": 1000,
    "chains": 1,
    "devices": 1,
    "blocking": "thermal-algorithm",
    "schedule": "fixed"
  },
  "env": {
    "jax": "0.8.0",
    "thrml": "thermal-algorithms"
  },
  "power_watts_avg": null,
  "metrics_mean": {
    "samples_per_sec": 3639.211961504246,
    "rho1": 0.12911692261695862,
    "tau_int": 1.2965195351021133,
    "ESS_per_sec": 2806.9086990020737
  },
  "notes": "Thermal Bandit Resource Orchestrator thermal algorithm benchmark on CPU"
}