{
  "task": "ising28_uncond",
  "hardware": "arm (JAX CPU)",
  "hardware_class": "cpu",
  "method": "thermal-srsl",
  "recipe_name": "srsl-cpu-thermal",
  "commit": "main",
  "contributor": "SoundSafe-Dev",
  "submission_url": "https://github.com/SoundSafe-Dev/thrml",
  "seeds": [
    42,
    123,
    456
  ],
  "config": {
    "H": 28,
    "W": 28,
    "steps_per_sample": 2,
    "warmup": 100,
    "n_samples": 1000,
    "chains": 1,
    "devices": 1,
    "blocking": "thermal-algorithm",
    "schedule": "fixed"
  },
  "env": {
    "jax": "0.8.0",
    "thrml": "thermal-algorithms"
  },
  "power_watts_avg": null,
  "metrics_mean": {
    "samples_per_sec": 150.70955724105602,
    "rho1": 0.49268653988838196,
    "tau_int": 2.942335769210547,
    "ESS_per_sec": 51.22106009046433
  },
  "notes": "Stochastic-Resonance Signal Lifter thermal algorithm benchmark on CPU"
}