{
  "task": "ising28_uncond",
  "hardware": "arm (JAX CPU)",
  "hardware_class": "cpu",
  "method": "thermal-ref",
  "recipe_name": "ref-cpu-thermal",
  "commit": "main",
  "contributor": "SoundSafe-Dev",
  "submission_url": "https://github.com/SoundSafe-Dev/thrml",
  "seeds": [
    42,
    123,
    456
  ],
  "config": {
    "H": 28,
    "W": 28,
    "steps_per_sample": 2,
    "warmup": 100,
    "n_samples": 1000,
    "chains": 1,
    "devices": 1,
    "blocking": "thermal-algorithm",
    "schedule": "fixed"
  },
  "env": {
    "jax": "0.8.0",
    "thrml": "thermal-algorithms"
  },
  "power_watts_avg": null,
  "metrics_mean": {
    "samples_per_sec": 2338.0169121309245,
    "rho1": 0.0673612430691719,
    "tau_int": 1.1444530212123019,
    "ESS_per_sec": 2042.9120888285117
  },
  "notes": "Reservoir-EBM Front-End thermal algorithm benchmark on CPU"
}